{
  "version": "1.0.0",
  "exported_at": "2025-12-27T12:00:00Z",
  "skills": [
    {
      "name": "evolve",
      "source": "github:ericksoa/agentic-evolve",
      "location": "personal"
    },
    {
      "name": "outlook-calendar",
      "source": "github:example/outlook-calendar-skill",
      "location": "personal"
    }
  ],
  "registries": [
    {
      "name": "community",
      "source": "https://raw.githubusercontent.com/ericksoa/grimoire/main/registries/community.json"
    }
  ],
  "settings": {
    "default_scope": "personal"
  }
}
